{
  "run_id": "run.hr-preview-003",
  "run_timestamp": "2026-05-10T02:15:00Z",
  "environment": "local_preview",
  "input_ref": "artifact://input/hr-request-003",
  "output_ref": "artifact://sample-output/hr-output-003",
  "tool_calls_summary": [
    "ticket-viewer:read_ticket"
  ],
  "errors_or_warnings": [],
  "reviewer_observation": "The fixture intentionally omits one required manifest field."
}
